SKU,Product Name,Product Type,Deck Category (Slide 3)
QP-12212,NOHrD Extension Bar,Rig and Rack Attachments,Functional Training
QP-12221,NOHrD Wall Bar Bench,Rig and Rack Attachments,Functional Training
QP-12230,NOHrD Combi Trainer,Rig and Rack Attachments,Functional Training
QP-15207,NOHrD Ankle Strap,Rig and Rack Attachments,Functional Training
QP-15216,NOHrD Aliminium Lat Bar,Rig and Rack Attachments,Functional Training
QP-15222,NOHrD Extension Handle,Rig and Rack Attachments,Functional Training
TDTL-1199,Nike Strength Dip Station,Rig and Rack Attachments,Functional Training
TSJC-1299,Nike Strength Premium J-Cups,Rig and Rack Attachments,Functional Training
TSTL-1199,Nike Strength Spotter Arms,Rig and Rack Attachments,Functional Training
SR104-BBL,RPM SESSION 4 Speed Rope,Rope Trainer,Functional Training
SR104-CHP,RPM SESSION 4 Speed Rope,Rope Trainer,Functional Training
SR104-KWV-STB,RPM SESSION 4 Speed Rope,Rope Trainer,Functional Training
SR104-RSE,RPM SESSION 4 Speed Rope,Rope Trainer,Functional Training
SR104-SOB,RPM SESSION 4 Speed Rope,Rope Trainer,Functional Training
SR104-STB,RPM SESSION 4 Speed Rope,Rope Trainer,Functional Training
SR104-STG-STB,RPM SESSION 4 Speed Rope,Rope Trainer,Functional Training
SR104-TBK,RPM SESSION 4 Speed Rope,Rope Trainer,Functional Training
SR104-TOP-TBK,RPM SESSION 4 Speed Rope,Rope Trainer,Functional Training
SR104-TWT,RPM SESSION 4 Speed Rope,Rope Trainer,Functional Training
SR104C-STB,RPM Comp4,Rope Trainer,Functional Training
SR104C-TBK,RPM Comp4,Rope Trainer,Functional Training
XERT-102,Torque USA Endless Rope Trainer,Rope Trainer,Functional Training
F-T20-GREY-V2-IG,Force USA EPDM Connector Zero Gap Tiles - Grey,Rubber Gym Flooring Tile,Functional Training
F-T20-WOOD-IG,Force USA Connector Zero Gap Tiles - Wood,Rubber Gym Flooring Tile,Functional Training
VF-CEP-BLACK-CORNER-IG,VersaFit Flooring Connector Elite Zero Gap Corner - Black,Rubber Gym Flooring Tile,Functional Training
VF-CEP-BLACK-EDGE-IG,VersaFit Flooring Connector Elite Zero Gap Edge - Black,Rubber Gym Flooring Tile,Functional Training
VF-CEP-BLACK-IG,VersaFit Flooring Connector Elite Zero Gap EPDM Tiles,Rubber Gym Flooring Tile,Functional Training
VF-CEP-IG,VersaFit Flooring Connector Elite Zero Gap EPDM Tiles,Rubber Gym Flooring Tile,Functional Training
VF-RT15-BF-V2,VersaFit Flooring Commercial Rubber Flooring Tiles  - 1m x 1m x 15mm,Rubber Gym Flooring Tile,Functional Training
VF-RT15-GF-V2,VersaFit Flooring Commercial Rubber Flooring Tiles  - 1m x 1m x 15mm,Rubber Gym Flooring Tile,Functional Training
VF-RT15-V2,VersaFit Flooring Commercial Rubber Flooring Tiles  - 1m x 1m x 15mm,Rubber Gym Flooring Tile,Functional Training
VF-RTE15-BF-V2,VersaFit Flooring Home Rubber Flooring Tiles - 1m x 1m x 15mm,Rubber Gym Flooring Tile,Functional Training
VF-RTE15-V2,VersaFit Flooring Home Rubber Flooring Tiles - 1m x 1m x 15mm,Rubber Gym Flooring Tile,Functional Training
VF-RTE50,VersaFit Flooring High Density Platform Tile - 1m x 1m x 50mm,Rubber Gym Flooring Tile,Functional Training
VF-SAMPLE,VersaFit Rubber Gym Tiles Sample Pack,Rubber Gym Flooring Tile,Functional Training
HSB10,CENTR X HYROX Competition Sandbag,Sand Bags,Functional Training
HSB20,CENTR X HYROX Competition Sandbag,Sand Bags,Functional Training
HSB30,CENTR X HYROX Competition Sandbag,Sand Bags,Functional Training
IFP1302-WX,Impulse IFP1302 Seated Row,Seated Row Machine,Functional Training
F-S-CSP,Force USA Solitude Chest / Shoulder Press Machine,Shoulder Press Machine,Functional Training
IF9312-IG,Impulse IF9312 Shoulder Press,Shoulder Press Machine,Functional Training
IFP1101-WX,Impulse IFP1101 Seated Shoulder Press,Shoulder Press Machine,Functional Training
IT9512-IG,Impulse Shoulder Press 200lb Stack,Shoulder Press Machine,Functional Training
SL7003,Impulse SL7003 Shoulder Press,Shoulder Press Machine,Functional Training
F-SR1,Force USA SR1 Speed Rope,Skipping Rope,Functional Training
F-SB10,Force USA Slam Balls,Slam Balls,Functional Training
F-SB12,Force USA Slam Balls,Slam Balls,Functional Training
F-SB15,Force USA Slam Balls,Slam Balls,Functional Training
F-SB20,Force USA Slam Balls,Slam Balls,Functional Training
F-SB25,Force USA Slam Balls,Slam Balls,Functional Training
F-SB30,Force USA Slam Balls,Slam Balls,Functional Training
F-SB35,Force USA Slam Balls,Slam Balls,Functional Training
F-SB4,Force USA Slam Balls,Slam Balls,Functional Training
F-SB40,Force USA Slam Balls,Slam Balls,Functional Training
F-SB5,Force USA Slam Balls,Slam Balls,Functional Training
F-SB6,Force USA Slam Balls,Slam Balls,Functional Training
F-SB7,Force USA Slam Balls,Slam Balls,Functional Training
F-SB8,Force USA Slam Balls,Slam Balls,Functional Training
F-SB9,Force USA Slam Balls,Slam Balls,Functional Training
IT7001,Impulse Ultimate Smith Machine,Smith Machine,Functional Training
.REP-SSB,REP Fitness Safety Squat Bar,Specialty Bar,Functional Training
750-00301-00-(IG),PowerBlock EZ Curl Bar (For Pro 50/Pro EXP),Specialty Bar,Functional Training
BB-4312,REP Fitness Cambered Swiss Bar,Specialty Bar,Functional Training
BBA-4211-2,REP Fitness Open Trap Bar Standard Handle,Specialty Bar,Functional Training
BCCO-0222,Nike Strength Shield Curl Bar – 10kg,Specialty Bar,Functional Training
BOTK-0164,Nike Strength Open Trap Bar – Black / Orange,Specialty Bar,Functional Training
BSCK-0222,Nike Strength Curl Bar – 10kg,Specialty Bar,Functional Training
F-HEXBAR,Force USA Hex Bar,Specialty Bar,Functional Training
F-TRAPBAR-02,Force USA Walkthrough Open Trap Bar,Specialty Bar,Functional Training
MS7042-WX,Impulse Farmer's Walk Bar,Specialty Bar,Functional Training
OCB,Force USA Olympic EZ Curl Barbell,Specialty Bar,Functional Training
OTB,Force USA Olympic Tricep Barbell,Specialty Bar,Functional Training
F-BULGARIAN,Force USA Bulgarian Split Squat,Squat Machine,Functional Training
F-SISSYSQUAT,Force USA Sissy Squat,Squat Machine,Functional Training
SL7057,Impulse SL7057 Pendulum Squat,Squat Machine,Functional Training
RSTL-1170,Nike Strength Squat Stand – Bundle,Squat Stand,Functional Training
F-OSSB,Force USA Olympic Safety Squat Barbell,Standard Barbells (28mm),Functional Training
STB,Force USA Standard Tricep Barbell,Standard Barbells (28mm),Functional Training
F-SRFUN,Force USA Functional Storage Rack,Storage,Functional Training
MS704001-WX,Impulse MS Series Storage Rack Frame,Storage,Functional Training
MS704004-WX,Impulse MS Series Ball Storage Rack,Storage,Functional Training
XTM1-WMSS-101,Torque USA Tank™ M1 Wall-Mounted Storage System,Storage,Functional Training
IFP1305-WX,Impulse IFP1305 T-Bar Row,T-Bar Row,Functional Training
XTWMH-101,Torque USA M1 Wall-Mounted Hanger,Torque USA Attachments,Functional Training
IT9518-IG,Impulse Torso Rotation 200lb Stack,Torso Trainer,Functional Training
BB-4211,REP Fitness Open Trap Bar,Trap Bar,Functional Training
F-WB12-V2,Force USA Elite Wall Balls,Wall Balls,Functional Training
F-WB6-V2,Force USA Elite Wall Balls,Wall Balls,Functional Training
F-WB9-V2,Force USA Elite Wall Balls,Wall Balls,Functional Training
HWB4,CENTR X HYROX Competition Wall Ball,Wall Balls,Functional Training
HWB6,CENTR X HYROX Competition Wall Ball,Wall Balls,Functional Training
HWB9,CENTR X HYROX Competition Wall Ball,Wall Balls,Functional Training
F-BPBST-V2,Force USA Bumper Plate and Barbell Storage Tree,Weight Plate Storage,Functional Training
MS704002-WX,Impulse MS Series Bumper Plate Storage,Weight Plate Storage,Functional Training
SSAS-1099,Nike Strength Plate Tree & Barbell Holder,Weight Plate Storage,Functional Training
THFS-1199,Nike Strength Half Rack Flat Storage Shelf,Weight Plate Storage,Functional Training
F-TACTICALVEST-B,Force USA Tactical Training Vest,Weight Vest,Functional Training
F-TACTICALVEST-CAMO,Force USA Camo Tactical Training Vest,Weight Vest,Functional Training
WVEST-V2,Force USA Weight Vest - 30kg,Weight Vest,Functional Training
F-VESTPLATE20,Force USA 2x 10kg Curved Weight Vest Plate ( Sold as Pair),Weight Vest Plate,Functional Training
F-VESTPLATE3-V2,Force USA 2x 2kg Curved Weight Vest Plate (Sold as Pair),Weight Vest Plate,Functional Training
F-VESTPLATE8-V2,Force USA 2x 4.5kg Curved Weight Vest Plate (Sold as Pair),Weight Vest Plate,Functional Training
22310,Harbinger FirmFit™ Contoured Belt,Weightlifting Belt,Functional Training
22320,Harbinger FirmFit™ Contoured Belt,Weightlifting Belt,Functional Training
22330,Harbinger FirmFit™ Contoured Belt,Weightlifting Belt,Functional Training
22340,Harbinger FirmFit™ Contoured Belt,Weightlifting Belt,Functional Training
23310,Harbinger 5 Inch Foam Core Belt,Weightlifting Belt,Functional Training
23320,Harbinger 5 Inch Foam Core Belt,Weightlifting Belt,Functional Training
23330,Harbinger 5 Inch Foam Core Belt,Weightlifting Belt,Functional Training
23340,Harbinger 5 Inch Foam Core Belt,Weightlifting Belt,Functional Training
28410,Harbinger 4-Inch Padded Leather Belt,Weightlifting Belt,Functional Training
28440,Harbinger 4-Inch Padded Leather Belt,Weightlifting Belt,Functional Training
BWTS,Centr Bodyweight Training Straps (Pair),Wrist Straps,Functional Training
F-YOGAMAT,Force USA Yoga Mat,Yoga Mat,Functional Training
F-YOGAMAT-HANGER,Force USA Yoga Mat Hanger,Yoga Mat,Functional Training
BW1.1,Centr Body Weight Home Gym Machine,Home Gym,Home Gyms
F-HG100,Force USA HG100 Home Gym,Home Gym,Home Gyms
F-HGPRO2,Force USA Multi Gym Pro 2,Home Gym,Home Gyms
F-MG4,Force USA Multi Gym 4,Home Gym,Home Gyms
IT9527-IG,Impulse 4 Stack Multi Gym 4 X 235Lb Stacks,Home Gym,Home Gyms
F-CKB10-V3,Force USA Competition Kettlebells V3,Cast Iron Kettlebells,Kettlebells
F-CKB12-V3,Force USA Competition Kettlebells V3,Cast Iron Kettlebells,Kettlebells
F-CKB16-V3,Force USA Competition Kettlebells V3,Cast Iron Kettlebells,Kettlebells
F-CKB20-V3,Force USA Competition Kettlebells V3,Cast Iron Kettlebells,Kettlebells
F-CKB24-V3,Force USA Competition Kettlebells V3,Cast Iron Kettlebells,Kettlebells
F-CKB28-V3,Force USA Competition Kettlebells V3,Cast Iron Kettlebells,Kettlebells
F-CKB32-V3,Force USA Competition Kettlebells V3,Cast Iron Kettlebells,Kettlebells
F-CKB8-V3,Force USA Competition Kettlebells V3,Cast Iron Kettlebells,Kettlebells
KRCU-GC08,Nike Strength Rubber Coated Kettlebell,Cast Iron Kettlebells,Kettlebells
KRCU-GC12,Nike Strength Rubber Coated Kettlebell,Cast Iron Kettlebells,Kettlebells
KRCU-GC16,Nike Strength Rubber Coated Kettlebell,Cast Iron Kettlebells,Kettlebells
KRCU-GC20,Nike Strength Rubber Coated Kettlebell,Cast Iron Kettlebells,Kettlebells
KRCU-GC24,Nike Strength Rubber Coated Kettlebell,Cast Iron Kettlebells,Kettlebells
HKT2025,CENTR X HYROX 2025 Collectible Kettlebell,Competition Kettlebells,Kettlebells
HUOKB16,CENTR X HYROX Competition Octo Kettlebell,Competition Kettlebells,Kettlebells
HUOKB24,CENTR X HYROX Competition Octo Kettlebell,Competition Kettlebells,Kettlebells
HUOKB32,CENTR X HYROX Competition Octo Kettlebell,Competition Kettlebells,Kettlebells
MS704003-WX,Impulse MS Series Kettlebell Storage Rack,Kettlebell Storage,Kettlebells
AS-ARWP,Assault Fitness  AssaultRower Pro,Air Rower,Other Equipment
F-R3,Force USA R3 Air Rower,Air Rower,Other Equipment
PFRW98120-INT,ProForm Pro R10 Rower,Air Rower,Other Equipment
ROW-TSR-101-F07,Torque USA Stealth Air™ Rower,Air Rower,Other Equipment
ROWERG,Concept 2 RowErg with Standard Legs,Air Rower,Other Equipment
STEPR-VPR-ROW,STEPR Rower XL VPR™,Air Rower,Other Equipment
AS-PACK1,Assault Fitness Cardio Workout Package,Cardio Package,Other Equipment
A003131,BLACKROLL Compression Boots,Compression Boots,Other Equipment
A003132,BLACKROLL Compression Boots,Compression Boots,Other Equipment
A003133,BLACKROLL Spare Batteries for Compression Boots,Compression Boots Battery Pack,Other Equipment
A30-XR Console,Matrix A30 Ascent Trainer,Cross Trainer,Other Equipment
E30-XIR Console,Matrix E30 Elliptical,Cross Trainer,Other Equipment
E30-XR Console,Matrix E30 Elliptical,Cross Trainer,Other Equipment
ECE5,Impulse Encore Cross Trainer,Cross Trainer,Other Equipment
FF-E3,Freeform Cardio E3 Elliptical Trainer,Cross Trainer,Other Equipment
PFEL07523-INT,Proform Trainer HL Stepper,Cross Trainer,Other Equipment
PFEL54925-INT,Proform Sport Elliptical,Cross Trainer,Other Equipment
PFEL55925-INT,Proform Carbon EL Elliptical,Cross Trainer,Other Equipment
RE500,Impulse RE500 Elliptical,Cross Trainer,Other Equipment
S-600E-F(IG),Vision Fitness Elliptical S600E,Cross Trainer,Other Equipment
S60-05,Vision Fitness S60 Performance Suspension Elliptical,Cross Trainer,Other Equipment
RE700,Impulse RE700 Elliptical,Elliptical Trainers,Other Equipment
AB-TS-T800-INTL-102-F07,Torque USA Air Bike Stealth T800 International (Satin Black),Fan Bike,Other Equipment
AS-ABPX,Assault Fitness AssaultBike Pro X,Fan Bike,Other Equipment
AS-ASSAULTB,Assault Fitness AssaultBike Classic,Fan Bike,Other Equipment
BikeErg,Concept 2 Bike Erg with PM5 Monitor,Fan Bike,Other Equipment
FF-AIR,Freeform Cardio Air Bike,Fan Bike,Other Equipment
STEPR-VPR-BIO,STEPR Bionic Bike XL VPR™,Fan Bike,Other Equipment
STEPR-VPR-CYCLE,STEPR Cycle XL VPR™,Fan Bike,Other Equipment
297,TriggerPoint NANO Foot Roller,Foam Roller / Therapy Roller,Other Equipment
3339,TriggerPoint Grid Vibe Plus Roller,Foam Roller / Therapy Roller,Other Equipment
3341,TriggerPoint Charge Vibe,Foam Roller / Therapy Roller,Other Equipment
F-BLACK-FOAMROLLER,Force USA Foam Roller - 90cm (Black),Foam Roller / Therapy Roller,Other Equipment
FRR-SMALL-30,PTP Fascia Release Roller Small,Foam Roller / Therapy Roller,Other Equipment
MTR FIRM LARGE,PTP Massage Therapy Firm - LARGE | FIRM,Foam Roller / Therapy Roller,Other Equipment
F-HRM,Force USA Heart Rate Monitor,Heart Rate Monitor,Other Equipment
FIIT-HR-TRACKER,FIIT Tracker,Heart Rate Monitor,Other Equipment
R-ICEACRYK-BLK-CHILLER-COM-2HP,Revel Edur Noir Ice Bath Tub - Acrylic Ice Bath,Ice Bath,Other Equipment
R-ICEACRYK-BLK-CHILLER-XY-08-S,Revel Edur Noir Ice Bath Tub - Acrylic Ice Bath,Ice Bath,Other Equipment
R-ICEACRYK-BLK-CHILLER-XY-10-M,Revel Edur Noir Ice Bath Tub - Acrylic Ice Bath,Ice Bath,Other Equipment
R-ICEACRYK-BLK-CHILLER-XY-20-L,Revel Edur Noir Ice Bath Tub - Acrylic Ice Bath,Ice Bath,Other Equipment
R-ICEACRYK-BLK-ICECHILL-SY-10-I,Revel Edur Noir Ice Bath Tub - Acrylic Ice Bath,Ice Bath,Other Equipment
R-ICEACRYLIC,Revel Recovery Edur Ice Bath,Ice Bath,Other Equipment
R-ICEDUO-V2-CHILLER-COM-2HP-IG,Revel Glacier Duo – Premium Cedar Ice Bath,Ice Bath,Other Equipment
R-ICEDUO-V2-CHILLER-XY-10-M,Revel Glacier Duo – Premium Cedar Ice Bath,Ice Bath,Other Equipment
R-ICEDUO-V2-CHILLER-XY-20-L,Revel Glacier Duo – Premium Cedar Ice Bath,Ice Bath,Other Equipment
R-ICEDUO-V2-ICECHILL-SY-10-I,Revel Glacier Duo – Premium Cedar Ice Bath,Ice Bath,Other Equipment
R-ICESOLO-V3-CHILLER-COM-2HP-IG,Revel Glacier Solo – Premium Cedar Ice Bath,Ice Bath,Other Equipment
R-ICESOLO-V3-CHILLER-XY-08-S,Revel Glacier Solo – Premium Cedar Ice Bath,Ice Bath,Other Equipment
R-ICESOLO-V3-CHILLER-XY-10-M,Revel Glacier Solo – Premium Cedar Ice Bath,Ice Bath,Other Equipment
R-ICESOLO-V3-CHILLER-XY-20-L,Revel Glacier Solo – Premium Cedar Ice Bath,Ice Bath,Other Equipment
R-ICESOLO-V3-ICECHILL-SY-10-I,Revel Glacier Solo – Premium Cedar Ice Bath,Ice Bath,Other Equipment
A003467,BLACKROLL Air Lounger,Inflatable Lounger,Other Equipment
R-FI-3P,Revel Saunas Kora - 3 Person Far Infrared Sauna,Infrared Sauna,Other Equipment
R-FS-CABIN-2P-V2,Eclipse - 2 Person Full Spectrum Infrared Cabin Sauna,Infrared Sauna,Other Equipment
R-FS-PREM-2P,Revel Recovery Nova Infrared 2 Person Sauna,Infrared Sauna,Other Equipment
R-FS-PREM-3P,Revel Recovery Nova Infrared 3 Person Sauna,Infrared Sauna,Other Equipment
MYOSPHERE BLK,PTP Myosphere Black,Massage Ball,Other Equipment
MINI-PKG-AU,Theragun Mini,Massage Gun,Other Equipment
R-MASSAGEPRO,Revel Recovery Massage Gun Pro,Massage Gun,Other Equipment
4429,TriggerPoint Acucurve Cane,Massage Stick,Other Equipment
FF-RB7-V2,Freeform Cardio RB7 Recumbent Bike,Recumbent Bike,Other Equipment
R-600E-F(IG),Vision Fitness Recumbent Bike R600E,Recumbent Bike,Other Equipment
R30-XIR Console,Matrix R30 Recumbent Bike,Recumbent Bike,Other Equipment
R30-XR Console,Matrix R30 Recumbent Bike,Recumbent Bike,Other Equipment
R60-04,Vision Fitness R60 Performance Recumbent Bike,Recumbent Bike,Other Equipment
F-SKI-TRAINER & STAND,Force USA Ski Trainer,Ski Trainer,Other Equipment
S-ERG,Concept 2 Ski Erg,Ski Trainer,Other Equipment
STEPR-VPR-SKI,STEPR Ski XL VPR™,Ski Trainer,Other Equipment
XRR-SKI-101,Torque USA Relentless Ripper,Ski Trainer,Other Equipment
100893,Schwinn 800IC (IC8) Indoor Cycling Bike,Spin Bike,Other Equipment
V-PULSE,Vortex Pulse Spin Bike,Spin Bike,Other Equipment
V-V1600,Vortex V1600 Spin Bike,Spin Bike,Other Equipment
STEPR-CL,STEPR Classic Stair Climber (LED Console),Stair Climber,Other Equipment
STEPR-GO,STEPR Go - LED Console with Bluetooth Connectivity,Stair Climber,Other Equipment
STEPR-H-M,"STEPR+ Stair Climber (27"" Touchscreen)",Stair Climber,Other Equipment
STEPR-PRO-CL,STEPR PRO Classic Stair Climber (LED Console),Stair Climber,Other Equipment
STEPR-PRO-H,"STEPR PRO+ Stair Climber (27"" Touchscreen)",Stair Climber,Other Equipment
STEPR-XL-CL,STEPR XL - Classic,Stair Climber,Other Equipment
R-TR-3P-V2,Revel Saunas Tampere - 3 Person Traditional Finnish Sauna with Step,Traditional Sauna,Other Equipment
R-TR-4P-V2,Revel Recovery Tampere 3 Person Traditional Finnish Sauna,Traditional Sauna,Other Equipment
ECU7,Impulse Encore Upright Bike,Upright Bike,Other Equipment
FF-UB5,Freeform Cardio UB5 Upright Bike,Upright Bike,Other Equipment
RU700,Impulse RU700 Upright Bike,Upright Bike,Other Equipment
U-30-02-F-XIR Console,Matrix U30 Upright Bike,Upright Bike,Other Equipment
U-30-02-F-XR Console,Matrix U30 Upright Bike,Upright Bike,Other Equipment
U-600E-F(IG),Vision Fitness Upright U600E,Upright Bike,Other Equipment
U60-04,Vision Fitness U60 Performance Upright Bike,Upright Bike,Other Equipment
129HOME,WaterRower A1 Home with A1 Monitor,Water Resistance Rowing Machine,Other Equipment
150S4RETAIL,WaterRower Club S4,Water Resistance Rowing Machine,Other Equipment
510-S4,WaterRower M1 HiRise WaterRower,Water Resistance Rowing Machine,Other Equipment
AC2990-IG,Impulse AC Treadmill,Electric Treadmill,Treadmills
BOWFLEX-T6,Bowflex T6 Treadmill,Electric Treadmill,Treadmills
BOWFLEX-T9,Bowflex T9 Treadmill,Electric Treadmill,Treadmills
F-GLIDE-T2,Force USA Glide Treadmill,Electric Treadmill,Treadmills
FF-T10,Freeform Cardio T10 Treadmill,Electric Treadmill,Treadmills
FF-T20,Freeform Cardio T20 Treadmill,Electric Treadmill,Treadmills
PFTL10925-INT,ProForm Carbon Pro 2000 Treadmill,Electric Treadmill,Treadmills
PFTL16925-INT,Proform Carbon Pro 9000 Treadmill,Electric Treadmill,Treadmills
PFTL38825-INT,Proform Sport Treadmill,Electric Treadmill,Treadmills
PFTL79925-INT,Proform Carbon TLS Treadmill,Electric Treadmill,Treadmills
PFTL90925-INT,ProForm Carbon TLX Treadmill,Electric Treadmill,Treadmills
RT700,Impulse Treadmill RT700,Electric Treadmill,Treadmills
RUNR,Centr Runr Treadmill,Electric Treadmill,Treadmills
RUNR-S,Centr Runr-S Treadmill,Electric Treadmill,Treadmills
T600-03,Vision Fitness T600 Performance Treadmill,Electric Treadmill,Treadmills
T600-E-02,Vision Fitness Treadmill T600E-02,Electric Treadmill,Treadmills
TREAD-XP,Horizon Treadmill Tread XP,Electric Treadmill,Treadmills
AS-ARC,Assault Fitness Runner Classic,Manual Treadmill,Treadmills
AS-ARE,AssaultRunner Elite,Manual Treadmill,Treadmills
AS-ARP,Assault Fitness AssaultRunner Pro,Manual Treadmill,Treadmills
NMT.3,CENTR X HYROX Perform Tread,Manual Treadmill,Treadmills
STEPR-VPR-TREAD,STEPR Treadsled XL VPR™,Manual Treadmill,Treadmills
F-PGB10C,Force USA Pro Grade Coloured Bumper Plates (Sold individually),Bumper Plates,Weight Plates
F-PGB15C,Force USA Pro Grade Coloured Bumper Plates (Sold individually),Bumper Plates,Weight Plates
F-PGB20C,Force USA Pro Grade Coloured Bumper Plates (Sold individually),Bumper Plates,Weight Plates
F-PGB25C,Force USA Pro Grade Coloured Bumper Plates (Sold individually),Bumper Plates,Weight Plates
F-PGB5C,Force USA Pro Grade Coloured Bumper Plates (Sold individually),Bumper Plates,Weight Plates
F-UTBP10,Force USA Ultimate Training Bumper Plates (Sold individually),Bumper Plates,Weight Plates
F-UTBP15,Force USA Ultimate Training Bumper Plates (Sold individually),Bumper Plates,Weight Plates
F-UTBP20,Force USA Ultimate Training Bumper Plates (Sold individually),Bumper Plates,Weight Plates
F-UTBP25,Force USA Ultimate Training Bumper Plates (Sold individually),Bumper Plates,Weight Plates
F-UTBP5,Force USA Ultimate Training Bumper Plates (Sold individually),Bumper Plates,Weight Plates
PBAK-1005,Nike Strength Rubber Bumper Plates (Sold Individually),Bumper Plates,Weight Plates
PBAK-1010,Nike Strength Rubber Bumper Plates (Sold Individually),Bumper Plates,Weight Plates
PBAK-1015,Nike Strength Rubber Bumper Plates (Sold Individually),Bumper Plates,Weight Plates
PBAK-1020,Nike Strength Rubber Bumper Plates (Sold Individually),Bumper Plates,Weight Plates
PBAK-1025,Nike Strength Rubber Bumper Plates (Sold Individually),Bumper Plates,Weight Plates
PCAK-0150,Nike Strength Change Plates (Sold Individually),Bumper Plates,Weight Plates
PCAK-2052,Nike Strength Change Plates (Sold Individually),Bumper Plates,Weight Plates
PCAK-4051,Nike Strength Change Plates (Sold Individually),Bumper Plates,Weight Plates
PCAK-5001,Nike Strength Change Plates (Sold Individually),Bumper Plates,Weight Plates
PCAK-6002,Nike Strength Change Plates (Sold Individually),Bumper Plates,Weight Plates
PGAK-1005,Nike Strength Grind Bumper Plates (Sold Individually),Bumper Plates,Weight Plates
PGAK-1010,Nike Strength Grind Bumper Plates (Sold Individually),Bumper Plates,Weight Plates
PGAK-1015,Nike Strength Grind Bumper Plates (Sold Individually),Bumper Plates,Weight Plates
PGAK-1020,Nike Strength Grind Bumper Plates (Sold Individually),Bumper Plates,Weight Plates
PGAK-9705,Nike Strength Grind Bumper Plates (Sold Individually),Bumper Plates,Weight Plates
PGAK-9710,Nike Strength Grind Bumper Plates (Sold Individually),Bumper Plates,Weight Plates
PGAK-9715,Nike Strength Grind Bumper Plates (Sold Individually),Bumper Plates,Weight Plates
PGAK-9720,Nike Strength Grind Bumper Plates (Sold Individually),Bumper Plates,Weight Plates
HUBP25,CENTR X HYROX 25kg Competition Interlocking Plate,Olympic Weight Plates,Weight Plates
PCGK-1101,Nike Strength Grind Change Plates,Olympic Weight Plates,Weight Plates
PCGK-1102,Nike Strength Grind Change Plates,Olympic Weight Plates,Weight Plates
PCGK-1150,Nike Strength Grind Change Plates,Olympic Weight Plates,Weight Plates
PCGK-1151,Nike Strength Grind Change Plates,Olympic Weight Plates,Weight Plates
PCGK-1152,Nike Strength Grind Change Plates,Olympic Weight Plates,Weight Plates
RCOWP050,Force USA Rubber Coated 51mm Olympic Weight Plates (Sold individually),Olympic Weight Plates,Weight Plates
RCOWP1000,Force USA Rubber Coated 51mm Olympic Weight Plates (Sold individually),Olympic Weight Plates,Weight Plates
RCOWP125,Force USA Rubber Coated 51mm Olympic Weight Plates (Sold individually),Olympic Weight Plates,Weight Plates
RCOWP1500,Force USA Rubber Coated 51mm Olympic Weight Plates (Sold individually),Olympic Weight Plates,Weight Plates
RCOWP2000,Force USA Rubber Coated 51mm Olympic Weight Plates (Sold individually),Olympic Weight Plates,Weight Plates
RCOWP250,Force USA Rubber Coated 51mm Olympic Weight Plates (Sold individually),Olympic Weight Plates,Weight Plates
RCOWP2500,Force USA Rubber Coated 51mm Olympic Weight Plates (Sold individually),Olympic Weight Plates,Weight Plates
RCOWP500,Force USA Rubber Coated 51mm Olympic Weight Plates (Sold individually),Olympic Weight Plates,Weight Plates
