SKU,Product Name,Product Type,Deck Category (Slide 3)
F-ABMAT,Force USA Ab Mat,Ab Mats,Functional Training
IT9514-IG,Impulse Abdominal 235lb Stack,Abdominal Machine,Functional Training
F-WS-UPGRADE-50lbs,Force USA Weight Stack Upgrade (1 x 22.5kg),Additional Weight Stack,Functional Training
AB-4102-BLU,REP Fitness Nighthawk Adjustable Bench,Adjustable Bench,Functional Training
AB-4102-MBLK,REP Fitness Nighthawk Adjustable Bench,Adjustable Bench,Functional Training
AB-4102-OLV,REP Fitness Nighthawk Adjustable Bench,Adjustable Bench,Functional Training
AB-4102-RED,REP Fitness Nighthawk Adjustable Bench,Adjustable Bench,Functional Training
AB-4102-WHT,REP Fitness Nighthawk Adjustable Bench,Adjustable Bench,Functional Training
AB-5200,REP Fitness AB-5200 2.0 Adjustable Bench,Adjustable Bench,Functional Training
AB-5300-IG,REP Fitness Blackwing Adjustable Bench,Adjustable Bench,Functional Training
F-BENCHPRESS,Force USA Adjustable Bench Press,Adjustable Bench,Functional Training
F-C10-SB,Force USA Sliding Bench,Adjustable Bench,Functional Training
F-COMFID-V3,Force USA Commercial FID Bench,Adjustable Bench,Functional Training
F-MR-FID-V2,Force USA FID Bench with Arm and Leg Developer,Adjustable Bench,Functional Training
F-PS-FID,Force USA Pro Series FID Bench,Adjustable Bench,Functional Training
F-SFID,Force USA Studio FID Bench,Adjustable Bench,Functional Training
F-SP3,Force USA SP3 FID Bench,Adjustable Bench,Functional Training
FID5,"Centr Multi-Adjustable Flat, Incline, Decline, Workout Bench",Adjustable Bench,Functional Training
IT7011,Impulse Ultimate Multi Adjustable Bench,Adjustable Bench,Functional Training
NAWU-1199,Nike Strength Adjustable Weight Bench,Adjustable Bench,Functional Training
501-00096-01,PowerBlock Elite EXP Stage 1,Adjustable Dumbbells,Functional Training
501-00097-01,PowerBlock Elite EXP Stage 2,Adjustable Dumbbells,Functional Training
501-00098-01,PowerBlock Elite EXP Stage 3,Adjustable Dumbbells,Functional Training
503-00099-04,PowerBlock Sport 24 - 2 x 11kg,Adjustable Dumbbells,Functional Training
503-00648-01,PowerBlock Sport EXP Stage 2 Kit,Adjustable Dumbbells,Functional Training
504-00183-03,PowerBlock Pro 100 EXP Knurl Stage 1,Adjustable Dumbbells,Functional Training
504-00185-01,PowerBlock Pro 100 EXP Stage 3,Adjustable Dumbbells,Functional Training
504-00186-01,PowerBlock Pro 100 EXP Stage 4,Adjustable Dumbbells,Functional Training
505-00120-01,PowerBlock Pro 32 - 2 x 14.5kg,Adjustable Dumbbells,Functional Training
750-00312-00,PowerBlock Pro 125 Commercial - 2 x 57.6kg,Adjustable Dumbbells,Functional Training
DIAK-1P27-IG,Nike Strength Adjustable Dumbbells,Adjustable Dumbbells,Functional Training
F-ODH,Force USA Olympic Dumbbell Handles,Adjustable Dumbbells,Functional Training
505-00119-01,PowerBlock Pro Commercial Upgrade Kit,Adjustable Dumbbells Attachment,Functional Training
IT9525-IG,Impulse Hi Low Pulley 235lb Stack,Adjustable Pulley Machine,Functional Training
IT9530-IG,Impulse Dual Adjustable Pulley,Adjustable Pulley Machine,Functional Training
F-C10,Force USA C10 All-In-One Trainer,All-In-One Trainer,Functional Training
F-C20,Force USA C20 All-In-One Trainer,All-In-One Trainer,Functional Training
F-G1-V2,Force USA G1® All-In-One Trainer,All-In-One Trainer,Functional Training
F-G12-V2,Force USA G12 All-In-One Trainer,All-In-One Trainer,Functional Training
F-G15-B,Force USA G15® All-In-One Trainer,All-In-One Trainer,Functional Training
F-G20-V2,Force USA G20 Pro™ All-In-One Trainer,All-In-One Trainer,Functional Training
F-G3-V2,Force USA G3® All-In-One Trainer,All-In-One Trainer,Functional Training
F-G4,Force USA G4 All-In-One Trainer,All-In-One Trainer,Functional Training
F-M10-150-IG,Force USA M10 All-In-One Trainer,All-In-One Trainer,Functional Training
F-M10-150-S-IG,Force USA M10 All-In-One Trainer,All-In-One Trainer,Functional Training
F-M10-200-IG,Force USA M10 All-In-One Trainer,All-In-One Trainer,Functional Training
F-M10-200-S-IG,Force USA M10 All-In-One Trainer,All-In-One Trainer,Functional Training
F-M10-PL-IG,Force USA M10 All-In-One Trainer,All-In-One Trainer,Functional Training
F-M10-PL-S-IG,Force USA M10 All-In-One Trainer,All-In-One Trainer,Functional Training
F-C10-ALU,Force USA Aluminium Pulley Upgrade,All-In-One Trainer Attachment,Functional Training
F-C10-M-CHART,Force USA C10 Magnetic Exercise Chart (Set),All-In-One Trainer Attachment,Functional Training
F-DIP-BAR,Force USA Dip Handle Bar (Pair),All-In-One Trainer Attachment,Functional Training
F-DIP-HANDLES,Force USA Dip Handles,All-In-One Trainer Attachment,Functional Training
F-FT-ALU,Force USA Aluminium Pulley Upgrade,All-In-One Trainer Attachment,Functional Training
F-FT-WSUPGRADE,Force USA Functional Trainer Weight Stack Upgrade (2 x 30kg),All-In-One Trainer Attachment,Functional Training
F-G1-V2-ALU,Force USA Aluminium Pulley Upgrade,All-In-One Trainer Attachment,Functional Training
F-G10&G15UPGRADE,Force USA G10® and G15® All-In-One-Trainer Upgrade Kit,All-In-One Trainer Attachment,Functional Training
F-G10-G15-SHELVES-TVM,Force USA G10 & G15 Shelves & TV Mount,All-In-One Trainer Attachment,Functional Training
F-G12-V2-ALU,Force USA Aluminium Pulley Upgrade,All-In-One Trainer Attachment,Functional Training
F-G15-ALU,Force USA Aluminium Pulley Upgrade,All-In-One Trainer Attachment,Functional Training
F-G20-V2-ALU,Force USA Aluminium Pulley Upgrade,All-In-One Trainer Attachment,Functional Training
F-G3-V2-ALU,Force USA Aluminium Pulley Upgrade,All-In-One Trainer Attachment,Functional Training
F-G6-B-ALU,Force USA Aluminium Pulley Upgrade,All-In-One Trainer Attachment,Functional Training
F-GS-LEG-EXT-CURL,Force USA Leg Extension and Curl Attachment,All-In-One Trainer Attachment,Functional Training
F-JAMMER-2,Force USA Jammer Arms,All-In-One Trainer Attachment,Functional Training
F-LATROWSEAT-2,Force USA Lat Pull Down Seat,All-In-One Trainer Attachment,Functional Training
F-LH-FP,Force USA Leg Holder and Low Row Footplate,All-In-One Trainer Attachment,Functional Training
F-SB-TT,Force USA Tandem Tower Sliding Bench Attachment,All-In-One Trainer Attachment,Functional Training
F-SPOTTER-3,Force USA Spotter Arm (Pair),All-In-One Trainer Attachment,Functional Training
F-X15-X20-V2-ALU,Force USA Aluminium Pulley Upgrade,All-In-One Trainer Attachment,Functional Training
F-F100SP,Force USA F100 Starter Package,All-In-One Trainer Package,Functional Training
F-G12BP,Force USA G12 Starter Package,All-In-One Trainer Package,Functional Training
F-G12SP,Force USA G12 Studio Package,All-In-One Trainer Package,Functional Training
F-G15BP,Force USA G15 Starter Package,All-In-One Trainer Package,Functional Training
F-G15SP-V2,Force USA G15 Studio Package,All-In-One Trainer Package,Functional Training
F-G1BP,Force USA G1 Starter Package,All-In-One Trainer Package,Functional Training
F-G1SP,Force USA G1 Studio Package,All-In-One Trainer Package,Functional Training
F-G20-V2-BP,Force USA G20 Starter Package,All-In-One Trainer Package,Functional Training
F-G20SP,Force USA G20 Studio Package,All-In-One Trainer Package,Functional Training
F-G3-V2-BP,Force USA G3 Starter Package,All-In-One Trainer Package,Functional Training
F-G3SP,Force USA G3 Studio Package,All-In-One Trainer Package,Functional Training
23-AS-1504-A,Assault Fitness Water Bottle/Phone Holder,AssaultBike Attachments,Functional Training
23-AS-586-A,Assault Fitness Pro Runner Water Bottle Phone Holder,AssaultBike Attachments,Functional Training
AS-ASSFIIT,Assault Fitness AssaultBike Classic FiiT Upgrade,AssaultBike Attachments,Functional Training
PART-AS-ASSAULT-ELITE-314,Assault Fitness Pro/Elite Bike Console,AssaultBike Attachments,Functional Training
PART-AS-ASSAULTB-14,Assault Fitness AssaultBike Console/Computer,AssaultBike Attachments,Functional Training
PART-AS-ASSAULTB-17,Assault Fitness Crank Arm - Right PP,AssaultBike Attachments,Functional Training
PART-AS-ASSAULTB-24,"Assault Fitness Chain - Right Side w/Universal Link 1/2"" x 1/8"" x 64 Links",AssaultBike Attachments,Functional Training
PART-AS-ASSAULTB-25,"Assault Fitness Chain - Left Side w/Universal Link 2016+ 1/2"" x 1/8"" x 98 Links",AssaultBike Attachments,Functional Training
PART-AS-ASSAULTB-40,Assault Fitness Bell Crank - Left PP,AssaultBike Attachments,Functional Training
PART-AS-ASSAULTB-42,Assault Fitness Crank Arm/Bell Crank Fixing Bolt - 8mm (42),AssaultBike Attachments,Functional Training
PART-AS-ASSAULTB-62-ASSEMBLED,Assault Fitness 23-AS-062 Assembly Part#60 Bracket & Part#62 Speed Sensor,AssaultBike Attachments,Functional Training
PART-AS-ASSAULTB-89,Assault Fitness Wind Screen,AssaultBike Attachments,Functional Training
F-S-ACUD,Force USA Solitude Assisted Chin-Up / Dip Machine,Assisted Chin/Dip Combo Machine,Functional Training
IT7010EOPT,Impulse Optional Chin Up Attachment (Fits onto IT7010),Assisted Chin/Dip Combo Machine,Functional Training
IT9520-IG,Impulse Assisted Chin/Dip Combo 235Lb Stack,Assisted Chin/Dip Combo Machine,Functional Training
F-ALUOLYLOCK,Force USA Aluminium Olympic Lock Collars - Pair,Barbell Collars,Functional Training
F-OLYLOCK,Force USA Olympic Quick Lock Collars - Pair,Barbell Collars,Functional Training
F-STANLOCK,Force USA Standard Quick Lock Collars - Pair,Barbell Collars,Functional Training
F-XCALIBUR-BLACK,Force USA Xcalibur Olympic Collars,Barbell Collars,Functional Training
F-XCALIBUR-BLUE,Force USA Xcalibur Olympic Collars,Barbell Collars,Functional Training
F-XCALIBUR-SILVER,Force USA Xcalibur Olympic Collars,Barbell Collars,Functional Training
OSC,Force USA Olympic Spring Collars - Pair,Barbell Collars,Functional Training
ZCAU-0199,Nike Strength Barbell Collars,Barbell Collars,Functional Training
ZCAU-1399,Nike Strength Barbell Collars,Barbell Collars,Functional Training
ZCAU-1A99,Nike Strength Barbell Collars,Barbell Collars,Functional Training
ZCAU-A199,Nike Strength Barbell Collars,Barbell Collars,Functional Training
ZCAU-V199,Nike Strength Barbell Collars,Barbell Collars,Functional Training
MS7041-WX,Impulse MS Series Barbell Lifter,Barbell Lifter,Functional Training
F-PGBPACK5,Force USA 160kg Pro Bumper Plate Package 5,Barbell Package,Functional Training
F-PGBPACK6,Force USA 220kg Pro Bumper Plate Package 6,Barbell Package,Functional Training
F-UTBPPACK1,Force USA 170kg Bumper Plate Package,Barbell Package,Functional Training
F-UTBPPACK2,Force USA 320kg Bumper Plate Package 2,Barbell Package,Functional Training
F-UTBPPACK3,Force USA 115kg Bumper Plate Package 3,Barbell Package,Functional Training
F-UTBPPACK4,Force USA 80kg Bumper Plate Package 4,Barbell Package,Functional Training
OBT-PACK,195kg Barbell & Weights Pack,Barbell Package,Functional Training
PACKAGE-NIKE-10-IG,Nike Strength Barbell and Grind Plate Set,Barbell Package,Functional Training
PACKAGE-NIKE-11-IG,Nike Strength Barbell and Grind Plate Set,Barbell Package,Functional Training
PACKAGE-NIKE-12-IG,Nike Strength Barbell and Grind Plate Set,Barbell Package,Functional Training
PACKAGE-NIKE-6-IG,Nike Strength Barbell and Rubber Plate Set,Barbell Package,Functional Training
PACKAGE-NIKE-7-IG,Nike Strength Barbell and Rubber Plate Set,Barbell Package,Functional Training
PACKAGE-NIKE-8-IG,Nike Strength Barbell and Rubber Plate Set,Barbell Package,Functional Training
F-BP,Force USA Barbell Pad,Barbell Pads,Functional Training
300ROLY.2,Centr 300 LB (136 KG) Olympic Set With Bar Caps,Barbell Sets and Packages,Functional Training
F-FIXEDCURLBARBELLSET,Force USA Fixed Curl Barbell Set and Stand,Barbell Sets and Packages,Functional Training
F-FIXEDSTBARBELLSET,Force USA Fixed Straight Barbell Set and Stand,Barbell Sets and Packages,Functional Training
MS44-WX,Impulse MS Series Barbell/Utility Plateform Storage Attachment,Barbell Storage,Functional Training
CBR,Centr Battle Rope,Battle Rope,Functional Training
F-BROPE15,Force USA 15m Battle Rope,Battle Rope,Functional Training
HBR,CENTR X HYROX Competition Power Rope,Battle Rope,Functional Training
IFP1615-WX,Impulse IFP1615 Belt Squat,Belt Squat,Functional Training
AB-5000-01,REP Fitness Leg Roller for AB-5000 Bench,Bench Attachment,Functional Training
F-S-BT,Force USA Solitude Bicep / Tricep Machine,Bicep Curl/Tricep Extension Machine,Functional Training
IT9503-IG,Impulse Arm Curl 235lb Stack,Bicep Curl/Tricep Extension Machine,Functional Training
PL9023-IG,Impulse Studio Biceps/Triceps,Bicep Curl/Tricep Extension Machine,Functional Training
PBP12V19B01,PUNCH Equipment Trophy Getters Boxing Belly Pad - Black/White,Boxing Belly Pad,Functional Training
WFPGSBV30,PUNCH Equipment Womens Boxing Focus Pads - Skull Art - Black,Boxing Focus Pads,Functional Training
PBG11UMEXB12V31,PUNCH Equipment Mexican Fuerte Ultra Boxing Gloves,Boxing Gloves,Functional Training
PBG11UMEXB16V31,PUNCH Equipment Mexican Fuerte Ultra Boxing Gloves,Boxing Gloves,Functional Training
PBG11UMEXW16V31,PUNCH Equipment Mexican Fuerte Ultra Boxing Gloves,Boxing Gloves,Functional Training
PBG5BWOZ08,PUNCH Equipment Trophy Getters® Commercial Boxing Gloves - Black,Boxing Gloves,Functional Training
PBG5BWOZ10,PUNCH Equipment Trophy Getters® Commercial Boxing Gloves - Black,Boxing Gloves,Functional Training
PBG5BWOZ12,PUNCH Equipment Trophy Getters® Commercial Boxing Gloves - Black,Boxing Gloves,Functional Training
PBG5BWOZ14,PUNCH Equipment Trophy Getters® Commercial Boxing Gloves - Black,Boxing Gloves,Functional Training
PBG5BWOZ16,PUNCH Equipment Trophy Getters® Commercial Boxing Gloves - Black,Boxing Gloves,Functional Training
PBG5BWOZ18,PUNCH Equipment Trophy Getters® Commercial Boxing Gloves - Black,Boxing Gloves,Functional Training
PBG622JB6V30,PUNCH Equipment Kids/Junior AAA Boxing Gloves - 6oz Black,Boxing Gloves,Functional Training
PBG95BOOZ12,PUNCH Equipment Black Diamond Muay Thai Boxing Gloves,Boxing Gloves,Functional Training
PBG95BOOZ16,PUNCH Equipment Black Diamond Muay Thai Boxing Gloves,Boxing Gloves,Functional Training
PBM1BW01,PUNCH Equipment Bag Busters® Boxing Mitts - Black,Boxing Gloves,Functional Training
PBM1BW02,PUNCH Equipment Bag Busters® Boxing Mitts - Black,Boxing Gloves,Functional Training
PBM1BW03,PUNCH Equipment Bag Busters® Boxing Mitts - Black,Boxing Gloves,Functional Training
PBM1BW04,PUNCH Equipment Bag Busters® Boxing Mitts - Black,Boxing Gloves,Functional Training
PBM4BW02,PUNCH Equipment Pro Bag Busters® Commercial Boxing Mitts - Black / White,Boxing Gloves,Functional Training
PBM4BW03,PUNCH Equipment Pro Bag Busters® Commercial Boxing Mitts - Black / White,Boxing Gloves,Functional Training
UBGB10V30,PUNCH Equipment Urban Boxing Gloves - Black,Boxing Gloves,Functional Training
UBGB12OZ,PUNCH Equipment Urban Boxing Gloves - Black,Boxing Gloves,Functional Training
UBGB16V30,PUNCH Equipment Urban Boxing Gloves - Black,Boxing Gloves,Functional Training
WBGGCMB12V31,PUNCH Equipment Womens Boxing Gloves - 12oz,Boxing Gloves,Functional Training
WBGGLIPB12V30,PUNCH Equipment Womens Boxing Gloves - 12oz,Boxing Gloves,Functional Training
CGTR,Force USA Close Grip Triangle,Cable Attachment,Functional Training
F-A-D-HANDLE,Force USA Single Knurled Handle (Pair),Cable Attachment,Functional Training
F-A-EZCURL,Force USA Revolving EZ Curl Bar,Cable Attachment,Functional Training
F-A-LAT-BAR,Force USA Aluminium Lat Pulldown Bar,Cable Attachment,Functional Training
F-A-SHORT-BAR,Force USA Aluminium Short Straight Bar,Cable Attachment,Functional Training
F-AC1,Force USA Ankle Cuff Pair,Cable Attachment,Functional Training
F-ANKLECUFF-2,Force USA Ankle Cuffs (Pair),Cable Attachment,Functional Training
F-BW-STRAP,Force USA Bodyweight Assist Strap,Cable Attachment,Functional Training
F-CGL,Force USA Close Grip Triangle / Landmine Handle,Cable Attachment,Functional Training
F-DCC,Force USA Dual Cable Connector,Cable Attachment,Functional Training
F-MAG-SET,Force USA Mag Grip Set,Cable Attachment,Functional Training
F-MULTI-LAT-BAR,Force USA Multi-Grip Lat Pulldown Bar,Cable Attachment,Functional Training
F-RCBR,Force USA Revolving Curl Row Bar,Cable Attachment,Functional Training
F-RCGVB,Force USA Close Grip V Bar,Cable Attachment,Functional Training
F-RDHPDB,Force USA Revolving D Handle Pulldown Bar,Cable Attachment,Functional Training
F-RLPDB,Force USA Lat Pulldown Bar,Cable Attachment,Functional Training
F-RSB,Force USA Revolving Straight Bar,Cable Attachment,Functional Training
F-SSHRG,Force USA Single Stirrup Handle With Rubber Grips,Cable Attachment,Functional Training
F-TPDB,Force USA Tricep Press Down Bar,Cable Attachment,Functional Training
F-TR,Force USA Tricep Rope,Cable Attachment,Functional Training
FTA-5040-PS,REP Fitness Pro Series Straight Bar,Cable Attachment,Functional Training
FTA-5060-PS,"REP Fitness Pro Series 48"" Solid Lat Bar",Cable Attachment,Functional Training
FTA-5065-PS,REP Fitness Pro Series Neutral Grip Lat Bar,Cable Attachment,Functional Training
FTA-5075-PS,REP Fitness Cable Attachment - Triangle Rowing Attachment Pro Series,Cable Attachment,Functional Training
FTA-5090-PS,REP Fitness Pro Series D Cable Handle,Cable Attachment,Functional Training
F-SRBase,Force USA Storage Rack Base,Cable Attachment Storage,Functional Training
F-SRPro,Force USA Storage Rack Pro,Cable Attachment Storage,Functional Training
F-MYRACK-CROSS,Force USA MyRack Cable Crossover Option (Single Side),Cable Crossover Attachment,Functional Training
F-TT-CB-IG,Force USA Tandem Tower Cross Beam Connector Set,Cable Crossover Attachment,Functional Training
IT9527OPT,Impulse Cable Cross Over Attachment,Cable Crossover Attachment,Functional Training
CALFBLK,Force USA Calf Block,Calf Machine,Functional Training
IFP1623-WX,Impulse IFP1623 Seated Calf Raise,Calf Machine,Functional Training
IT7005,Impulse Ultimate Seated Calf Raise,Calf Machine,Functional Training
IT9516-IG,Impulse Calf Raise 235lb Stack,Calf Machine,Functional Training
IF9329-IG,Impulse IF9329 Multi Bench Press,Chest Press Machine,Functional Training
IFP1201-WX,Impulse IFP1201 Seated Chest Press,Chest Press Machine,Functional Training
IT9501-IG,Impulse Chest Press 235lb Stack,Chest Press Machine,Functional Training
PL9021-IG,Impulse Studio Multi Press,Chest Press Machine,Functional Training
F-COREBAG10,Force USA Endurance Core Bag,Core Bags,Functional Training
F-COREBAG15,Force USA Endurance Core Bag,Core Bags,Functional Training
F-COREBAG20,Force USA Endurance Core Bag,Core Bags,Functional Training
F-COREBAG5,Force USA Endurance Core Bag,Core Bags,Functional Training
HSPCF35/MS32,Impulse MS Series Platform,Deadlifting Platform,Functional Training
SE5031/MS31,Impulse MS Series Platform,Deadlifting Platform,Functional Training
IT7016,Impulse Ultimate Decline Bench Press,Decline Bench Press Machine,Functional Training
IT7010,Impulse Ultimate Vertical Knee Raise,Dip Station,Functional Training
IT9517-IG,Impulse Seated Dip 235lb Stack,Dip Station,Functional Training
PACKAGE-NIKE-1-IG,Nike Strength Dumbbell Tree Set,Dumbbell Package,Functional Training
PACKAGE-NIKE-2-IG,Nike Strength Grind Dumbbell Tree Set,Dumbbell Package,Functional Training
PACKAGE-NIKE-5-IG,Nike Strength Grind Dumbbell Rack Set,Dumbbell Package,Functional Training
600-00140-00,PowerBlock Large Compact Stand,Dumbbell Rack & Storage,Functional Training
600-00184-00,PowerBlock PowerStand,Dumbbell Rack & Storage,Functional Training
600-00185-00,PowerBlock PowerMax Stand,Dumbbell Rack & Storage,Functional Training
DBA-6000-MAT-PBH,REP Fitness Dumbbell Storage Cart,Dumbbell Rack & Storage,Functional Training
DBA-6000-MBLK-PBH,REP Fitness Dumbbell Storage Cart,Dumbbell Rack & Storage,Functional Training
DBA-6000-WHT-PBH,REP Fitness Dumbbell Storage Cart,Dumbbell Rack & Storage,Functional Training
DBA-7000-01-MBLK,REP Fitness REP® Adjustable Dumbbell Stand,Dumbbell Rack & Storage,Functional Training
DBA-7000-01-WHT,REP Fitness REP® Adjustable Dumbbell Stand,Dumbbell Rack & Storage,Functional Training
DRV10,Force USA Vertical Dumbbell Rack (10 Pairs),Dumbbell Rack & Storage,Functional Training
F-DRACK3T,Force USA 3 Tier Dumbbell Rack,Dumbbell Rack & Storage,Functional Training
F-FIXEDSETSTAND,Force USA Fixed Barbell Stand,Dumbbell Rack & Storage,Functional Training
F-VDR-5-30,Force USA Vertical Dumbbell Rack 5-30kg (11 Pairs),Dumbbell Rack & Storage,Functional Training
MS704005-WX,Impulse MS Series Dumbbell Storage,Dumbbell Rack & Storage,Functional Training
SDAD-1165,Nike Strength Adjustable Dumbbell Stand,Dumbbell Rack & Storage,Functional Training
SDKS-1199,Nike Strength Kettlebell & Dumbbell Storage Rack,Dumbbell Rack & Storage,Functional Training
SDSL-1199,Nike Strength Dumbbell Storage Rack,Dumbbell Rack & Storage,Functional Training
SSDT-1099,Nike Strength Dumbbell Tree,Dumbbell Rack & Storage,Functional Training
SUDS-1299,Nike Strength Pro Urethane Dumbbell Rack,Dumbbell Rack & Storage,Functional Training
RHD1-10R,Force USA 1-10kg Rubber Hexagonal Dumbbell Set,Dumbbell Sets,Functional Training
RHD1-20-IG,1-20kg Rubber Hex Dumbbell & 3 Tier Rack Package,Dumbbell Sets & Packages,Functional Training
GAF-MAT,Gym and Fitness Equipment Mat,Equipment Mat,Functional Training
CBPRO 55CM PEARL VIOLET,PTP Coreball - 55 CM | Pearl Violet,Exercise Ball,Functional Training
CBPRO 75CM STEEL GREY,PTP Coreball - 75 CM | Steel Grey,Exercise Ball,Functional Training
DGHK-1101,Nike Strength Grind Dumbbell (Sold Individually),Fixed Dumbbells,Functional Training
DGHK-1102,Nike Strength Grind Dumbbell (Sold Individually),Fixed Dumbbells,Functional Training
DGHK-1103,Nike Strength Grind Dumbbell (Sold Individually),Fixed Dumbbells,Functional Training
DGHK-1104,Nike Strength Grind Dumbbell (Sold Individually),Fixed Dumbbells,Functional Training
DGHK-1105,Nike Strength Grind Dumbbell (Sold Individually),Fixed Dumbbells,Functional Training
DGHK-1106,Nike Strength Grind Dumbbell (Sold Individually),Fixed Dumbbells,Functional Training
DGHK-1107,Nike Strength Grind Dumbbell (Sold Individually),Fixed Dumbbells,Functional Training
DGHK-1108,Nike Strength Grind Dumbbell (Sold Individually),Fixed Dumbbells,Functional Training
DGHK-1109,Nike Strength Grind Dumbbell (Sold Individually),Fixed Dumbbells,Functional Training
DGHK-1110,Nike Strength Grind Dumbbell (Sold Individually),Fixed Dumbbells,Functional Training
DGHK-1112,Nike Strength Grind Dumbbell (Sold Individually),Fixed Dumbbells,Functional Training
DGHK-1115,Nike Strength Grind Dumbbell (Sold Individually),Fixed Dumbbells,Functional Training
DGHK-1117,Nike Strength Grind Dumbbell (Sold Individually),Fixed Dumbbells,Functional Training
DGHK-1120,Nike Strength Grind Dumbbell (Sold Individually),Fixed Dumbbells,Functional Training
DGHK-1122,Nike Strength Grind Dumbbell (Sold Individually),Fixed Dumbbells,Functional Training
DGHK-1125,Nike Strength Grind Dumbbell (Sold Individually),Fixed Dumbbells,Functional Training
DGHK-1127,Nike Strength Grind Dumbbell (Sold Individually),Fixed Dumbbells,Functional Training
DGHK-1130,Nike Strength Grind Dumbbell (Sold Individually),Fixed Dumbbells,Functional Training
DGHK-1132,Nike Strength Grind Dumbbell (Sold Individually),Fixed Dumbbells,Functional Training
DGHK-1135,Nike Strength Grind Dumbbell (Sold Individually),Fixed Dumbbells,Functional Training
DRCK-1001,Nike Strength Pro Urethane Dumbbells (Sold Individually),Fixed Dumbbells,Functional Training
DRCK-1002,Nike Strength Pro Urethane Dumbbells (Sold Individually),Fixed Dumbbells,Functional Training
DRCK-1003,Nike Strength Pro Urethane Dumbbells (Sold Individually),Fixed Dumbbells,Functional Training
DRCK-1004,Nike Strength Pro Urethane Dumbbells (Sold Individually),Fixed Dumbbells,Functional Training
DRCK-1005,Nike Strength Pro Urethane Dumbbells (Sold Individually),Fixed Dumbbells,Functional Training
DRCK-1006,Nike Strength Pro Urethane Dumbbells (Sold Individually),Fixed Dumbbells,Functional Training
DRCK-1007,Nike Strength Pro Urethane Dumbbells (Sold Individually),Fixed Dumbbells,Functional Training
DRCK-1008,Nike Strength Pro Urethane Dumbbells (Sold Individually),Fixed Dumbbells,Functional Training
DRCK-1009,Nike Strength Pro Urethane Dumbbells (Sold Individually),Fixed Dumbbells,Functional Training
DRCK-1010,Nike Strength Pro Urethane Dumbbells (Sold Individually),Fixed Dumbbells,Functional Training
DRCK-1012,Nike Strength Pro Urethane Dumbbells (Sold Individually),Fixed Dumbbells,Functional Training
DRCK-1014,Nike Strength Pro Urethane Dumbbells (Sold Individually),Fixed Dumbbells,Functional Training
DRCK-1016,Nike Strength Pro Urethane Dumbbells (Sold Individually),Fixed Dumbbells,Functional Training
DRCK-1018,Nike Strength Pro Urethane Dumbbells (Sold Individually),Fixed Dumbbells,Functional Training
DRCK-1020,Nike Strength Pro Urethane Dumbbells (Sold Individually),Fixed Dumbbells,Functional Training
DRCK-1022,Nike Strength Pro Urethane Dumbbells (Sold Individually),Fixed Dumbbells,Functional Training
DRCK-1024,Nike Strength Pro Urethane Dumbbells (Sold Individually),Fixed Dumbbells,Functional Training
DRCK-1026,Nike Strength Pro Urethane Dumbbells (Sold Individually),Fixed Dumbbells,Functional Training
DRCK-1028,Nike Strength Pro Urethane Dumbbells (Sold Individually),Fixed Dumbbells,Functional Training
DRCK-1030,Nike Strength Pro Urethane Dumbbells (Sold Individually),Fixed Dumbbells,Functional Training
DRCK-1032,Nike Strength Pro Urethane Dumbbells (Sold Individually),Fixed Dumbbells,Functional Training
DRCK-1034,Nike Strength Pro Urethane Dumbbells (Sold Individually),Fixed Dumbbells,Functional Training
DRCK-1036,Nike Strength Pro Urethane Dumbbells (Sold Individually),Fixed Dumbbells,Functional Training
DRCK-1038,Nike Strength Pro Urethane Dumbbells (Sold Individually),Fixed Dumbbells,Functional Training
DRCK-1040,Nike Strength Pro Urethane Dumbbells (Sold Individually),Fixed Dumbbells,Functional Training
